{
  "$schema": "https://json-schema.org/draft/2020-12/schema",
  "type": "object",
  "additionalProperties": false,
  "properties": {
    "schema_version": {
      "const": "2.0"
    },
    "video_id": {
      "type": "string",
      "minLength": 1
    },
    "narration_content_hash": {
      "type": "string",
      "pattern": "^[0-9a-f]{64}$"
    },
    "language": {
      "const": "en-US"
    },
    "cues": {
      "type": "array",
      "minItems": 1,
      "items": {
        "type": "object",
        "additionalProperties": false,
        "properties": {
          "cue_id": {
            "type": "string",
            "minLength": 1
          },
          "start_s": {
            "type": "number",
            "minimum": 0
          },
          "end_s": {
            "type": "number",
            "exclusiveMinimum": 0
          },
          "text": {
            "type": "string",
            "minLength": 1
          },
          "text_sha256": {
            "type": "string",
            "pattern": "^[0-9a-f]{64}$"
          }
        },
        "required": [
          "cue_id",
          "start_s",
          "end_s",
          "text",
          "text_sha256"
        ]
      }
    },
    "vtt_path": {
      "type": "string",
      "minLength": 1
    },
    "content_hash": {
      "type": "string",
      "pattern": "^[0-9a-f]{64}$"
    }
  },
  "required": [
    "schema_version",
    "video_id",
    "narration_content_hash",
    "language",
    "cues",
    "vtt_path",
    "content_hash"
  ]
}
