{
  "schema_version": "2.0",
  "video_id": "measurement-boundaries",
  "narration_content_hash": "7ff53f4ff972ccc19b8823e51bff97b2944cd8fd4d6f9a168a429683c9092dc9",
  "language": "en-US",
  "cues": [
    {
      "cue_id": "q0001",
      "start_s": 0.0,
      "end_s": 8.224,
      "text": "How can a kernel be faster while the easy public call is slower?",
      "text_sha256": "aa19f197e8fdc460b41a8e1d0cf44fb2c51295a4f3d88f43bc30158aa71749a3"
    },
    {
      "cue_id": "q0002",
      "start_s": 8.224,
      "end_s": 19.287,
      "text": "This episode has one job: A timing claim is meaningful only after every included and excluded stage is placed on a common pipeline.",
      "text_sha256": "a030f9f92a81dea2fac050edb399eb1f80316ccd816a04c40aee06f0f8b92de7"
    },
    {
      "cue_id": "q0003",
      "start_s": 19.287,
      "end_s": 30.35,
      "text": "We build on From DAGs to flat instructions: operations, storage, and execution; their definitions stay fixed while this lesson adds a new layer.",
      "text_sha256": "d347fcd2a86e1b6db6b1ef5c8738bc31188566115a61782c2243efe5a57d6138"
    },
    {
      "cue_id": "q0004",
      "start_s": 30.35,
      "end_s": 36.804,
      "text": "A measurement boundary specifies exactly which stages the timer includes.",
      "text_sha256": "a4856be6a404cb95a67697f1a27b3baf12ac0e59f38d339b2863c36bb7da21fd"
    },
    {
      "cue_id": "q0005",
      "start_s": 36.804,
      "end_s": 45.618,
      "text": "Watch for the label preparation; it stays attached to the artifact this episode means.",
      "text_sha256": "efaff97751ff69fe025998b358659b0e999e30b1763f266436e2ef65b27cebe7"
    },
    {
      "cue_id": "q0006",
      "start_s": 45.618,
      "end_s": 54.432,
      "text": "When we say evaluator kernel, the highlight identifies its layer before we interpret it.",
      "text_sha256": "6286e703999ea1fb0adfb53c810567b6383377dad49112f53c0535b367fe6d5d"
    },
    {
      "cue_id": "q0007",
      "start_s": 54.432,
      "end_s": 65.016,
      "text": "The term public wrapper receives its own visual state so it cannot drift into a neighboring concept.",
      "text_sha256": "f199fc8a4f0c066149dea64ae84670b562e2f8a9d00d79aa5f1d3271b08f0257"
    },
    {
      "cue_id": "q0008",
      "start_s": 65.016,
      "end_s": 72.65,
      "text": "We will keep end-to-end task visible whenever its definition controls the inference.",
      "text_sha256": "ec9ec8c963a7d33ed45c68057442cf1b9d92a24758c3444d9cdb526a9c2c1ae3"
    },
    {
      "cue_id": "q0009",
      "start_s": 72.65,
      "end_s": 83.234,
      "text": "The next sequence uses Shared Boolean expression as a conceptual teaching example, not as measured benchmark evidence.",
      "text_sha256": "39adabcae3dd3fe0db24b7b98bd3f7c2ad7f3ef4e1780a9f8e7e51e5b5d8a720"
    },
    {
      "cue_id": "q0010",
      "start_s": 83.234,
      "end_s": 87.917,
      "text": "Our stable example is Shared Boolean expression.",
      "text_sha256": "06056a6f0df0dcd045d01b7cf006584edcbe8a72439205d534b8073bd381e0e3"
    },
    {
      "cue_id": "q0011",
      "start_s": 87.917,
      "end_s": 98.98,
      "text": "S=A AND B; F=(S AND C AND D) OR (S AND E), with binary source syntax and stable variable order A,B,C,D,E.",
      "text_sha256": "83515dabb3aa1d6b6d4fa54b75f12c42a812bba3e2db0eb05fec1c8f60b543c5"
    },
    {
      "cue_id": "q0012",
      "start_s": 98.98,
      "end_s": 106.024,
      "text": "Carry AST, CSE, CSE-flat, CM-IR, lowering, and operation accounting across episodes.",
      "text_sha256": "83729225dac1e5f1d3fb638c6c74bf4f68db6230f5d73584636c688cdbb43544"
    },
    {
      "cue_id": "q0013",
      "start_s": 106.024,
      "end_s": 114.838,
      "text": "We now construct the Shared Boolean expression and name every part before interpreting it.",
      "text_sha256": "a722c553a50791052b18e82678624ed23e34426fead5d8c4595575401f4dfb08"
    },
    {
      "cue_id": "q0014",
      "start_s": 114.838,
      "end_s": 125.422,
      "text": "The accompanying view makes this step concrete: One persistent horizontal pipeline replaces separate cards for every boundary.",
      "text_sha256": "e45ade412d59d6c3cd251aeb1d6e2e828b3b9d0b2595c0b1aac2d2f2a62a5f27"
    },
    {
      "cue_id": "q0015",
      "start_s": 125.422,
      "end_s": 134.826,
      "text": "Move one request through preparation, artifact construction, repeated kernel, wrapper, extraction, persistence, and task completion.",
      "text_sha256": "25d816818118fb9b84e1501456043ac2343e5148af563708b5b66b2e529b7843"
    },
    {
      "cue_id": "q0016",
      "start_s": 134.826,
      "end_s": 144.23,
      "text": "Slide timing brackets over different stage subsets and change the allowed claim wording in lockstep.",
      "text_sha256": "9ddab8c33f115d154b5acd093bc6e93a60b6c3225809313a76fb747924d259c7"
    },
    {
      "cue_id": "q0017",
      "start_s": 144.23,
      "end_s": 153.634,
      "text": "Now isolate preparation, kernel, wrapper, extraction, persistence, and end-to-end timing boundaries inside Shared Boolean expression.",
      "text_sha256": "1bf4da05db35c9be2d2ba4340bccc12c5a574f6118dde8880ce6acb4ef1735b5"
    },
    {
      "cue_id": "q0018",
      "start_s": 153.634,
      "end_s": 164.697,
      "text": "The example definition and output meaning stay fixed while only the state for preparation, kernel, wrapper, extraction, persistence, and end-to-end timing boundaries changes.",
      "text_sha256": "aacfd173d5528e2c21dcff4f0586bd4531ceeeeba262b90d943fe6ac235a0ac2"
    },
    {
      "cue_id": "q0019",
      "start_s": 164.697,
      "end_s": 175.76,
      "text": "That matched before-and-after view assigns the visible consequence to preparation, kernel, wrapper, extraction, persistence, and end-to-end timing boundaries, not to a substituted workload.",
      "text_sha256": "75a10704897f1214e0d265121f21d257d62f72af9be27fae57d9be9d0df39a8d"
    },
    {
      "cue_id": "q0020",
      "start_s": 175.76,
      "end_s": 182.214,
      "text": "Colored brackets expand from kernel-only to wrapper and end-to-end scopes.",
      "text_sha256": "232c65f1a1d8527a0270e1aa83e2460b96514191eed0cd21ec3366cfb9ab42cf"
    },
    {
      "cue_id": "q0021",
      "start_s": 182.214,
      "end_s": 193.277,
      "text": "On the exactly counterbalanced B2/B4 V3 workload, formula-balanced bare CM/CSE-flat was 0.8906 with a formula-cluster 95% interval [0.8741, 0.9073].",
      "text_sha256": "8953193698c938da3ee9f42c75daa25a21806c2f391a69ed463287608aea6316"
    },
    {
      "cue_id": "q0022",
      "start_s": 193.277,
      "end_s": 202.681,
      "text": "Read that statement only within this scope: B2/B4 V3 formulas on one Windows run.",
      "text_sha256": "e1cfe09208a2e190b298c146e4eb64503a1eaab98f003c7de4ca3bbcd06f8d59"
    },
    {
      "cue_id": "q0023",
      "start_s": 202.681,
      "end_s": 209.135,
      "text": "Its declared measurement boundary is compiled evaluator kernel after compilation.",
      "text_sha256": "fd663d281ea4cd8be781d1a2a20c093eeb69709a14bd06fbc14fd3aa36e23f41"
    },
    {
      "cue_id": "q0024",
      "start_s": 209.135,
      "end_s": 217.359,
      "text": "The uncertainty field says formula-cluster bootstrap; does not model between-run or between-machine variation.",
      "text_sha256": "1123c11172a26f6c75ca30d343271aa6636deb29d23ab20068807e08cc9567e0"
    },
    {
      "cue_id": "q0025",
      "start_s": 217.359,
      "end_s": 224.993,
      "text": "The public CM wrapper was slower than CSE-flat in the corrected comparison.",
      "text_sha256": "fadffed25d6adb1ddb4de1f4616ea700e5610821666cd81927d2660b2d80fdb0"
    },
    {
      "cue_id": "q0026",
      "start_s": 224.993,
      "end_s": 232.037,
      "text": "Read that statement only within this scope: corrected B2/B4 comparison.",
      "text_sha256": "456777d16e508d439db56b5a56f7ec2662224ed6e5ae31a2a1f422c15e76b425"
    },
    {
      "cue_id": "q0027",
      "start_s": 232.037,
      "end_s": 238.491,
      "text": "Its declared measurement boundary is public wrapper complete truth-output call.",
      "text_sha256": "f3ecea78bd2b66135f1cd28f1b906c89f917053c9e98afe8e457eb6446698f2f"
    },
    {
      "cue_id": "q0028",
      "start_s": 238.491,
      "end_s": 245.535,
      "text": "The uncertainty field says local formula-cluster interval plus descriptive pod replication.",
      "text_sha256": "bc26babf1f206a72fce09bf918b092699c40773706d6e44e8bced9d1dedcfb3a"
    },
    {
      "cue_id": "q0029",
      "start_s": 245.535,
      "end_s": 256.598,
      "text": "EPFL CM preparation was 4.11x CSE-flat preparation; 55 of 129 cases never broke even under the retained calculation.",
      "text_sha256": "101b8474d77f5b6704b268140b5a11f79ab675c7a204ac513e7474142e78d0eb"
    },
    {
      "cue_id": "q0030",
      "start_s": 256.598,
      "end_s": 263.052,
      "text": "Read that statement only within this scope: accepted EPFL workload.",
      "text_sha256": "d3d14ecf514aee7cccf5c3ca6b20617690224865b5b2389c6757f9fabb25679d"
    },
    {
      "cue_id": "q0031",
      "start_s": 263.052,
      "end_s": 269.506,
      "text": "Its declared measurement boundary is preparation and modeled reuse break-even.",
      "text_sha256": "05503e204d338820844dfcd45a768a3d2c2a72c77cb1b03119dca48f477875a0"
    },
    {
      "cue_id": "q0032",
      "start_s": 269.506,
      "end_s": 274.189,
      "text": "The uncertainty field says descriptive retained calculation.",
      "text_sha256": "7bfd054b7c0f97cc0f9447ef3fc2e95bef7ea61b16f8f46f0d16b7c1d2dbe453"
    },
    {
      "cue_id": "q0033",
      "start_s": 274.189,
      "end_s": 281.823,
      "text": "Current evidence does not support a universal claim that CM beats CSE-flat.",
      "text_sha256": "d1515a3b3830b1cc563767394fc62475fae4442c3d8f3a9434d8bd29a659efbd"
    },
    {
      "cue_id": "q0034",
      "start_s": 281.823,
      "end_s": 287.687,